product_name,new_price,product_rating,Processor_OR_Generation,RAM(GB),Operating_System,SSD(GB),Display(cm),rating_without_dis
Ultimus Intel Celeron Dual Core N4020 - (4 GB/128 GB EMMC Storage/Windows 11 Home) NU14U3INC43BN-CS Th...,very low,Good,Intel Celeron Dual Core Processor,4.0,Windows 11 Operating System,35.81,1.0,3.9
HP 15s (2023) Intel Core i3 13th Gen 1315U - (8 GB/512 GB SSD/Windows 11 Home) 15-fd0006TU Thin and Li...,low,Excellent,Intel Core i3 Processor (13th Gen),8.0,64 bit Windows 11 Operating System,512.0,39.62,4.2
Lenovo IdeaPad Gaming 3 Intel Core i5 11th Gen 11320H - (16 GB/512 GB SSD/Windows 11 Home/4 GB Graphic...,low,Excellent,Intel Core i5 Processor (11th Gen),16.0,Windows 11 Operating System,512.0,39.62,4.5
Acer Predator Neo (2023) Intel Core i5 13th Gen 13500HX - (16 GB/512 GB SSD/Windows 11 Home/6 GB Graph...,Moderate,Excellent,Intel Core i5 Processor (13th Gen),16.0,Windows 11 Operating System,512.0,40.64,4.5
MSI Modern 14 AMD Ryzen 7 Octa Core 7730U - (16 GB/512 GB SSD/Windows 11 Home) Modern 14 C7M-218IN Thi...,low,Excellent,AMD Ryzen 7 Octa Core Processor,16.0,Windows 11 Operating System,512.0,35.56,4.4
DELL Intel Core i5 12th Gen 1235U - (16 GB/512 GB SSD/Windows 11 Home) Inspiron 3520 Thin and Light La...,low,Good,Intel Core i5 Processor (12th Gen),16.0,Windows 11 Operating System,512.0,39.62,3.4
MSI Cyborg 15 AI Intel Core Ultra 7 155H - (16 GB/1 TB SSD/Windows 11 Home/6 GB Graphics/NVIDIA GeForc...,Moderate,Good,Intel Core Ultra 7 Processor,16.0,Windows 11 Operating System,1000.0,39.62,3.8
Acer Predator Intel Core i9 13th Gen 13900HX - (16 GB/1 TB SSD/Windows 11 Home/8 GB Graphics/NVIDIA Ge...,Expensive,Excellent,Intel Core i9 Processor (13th Gen),16.0,Windows 11 Operating System,1000.0,40.64,4.6
DELL Intel Core i5 12th Gen 1235U - (8 GB/512 GB SSD/Windows 11 Home) New Inspiron 15 Laptop Thin and ...,low,Excellent,Intel Core i5 Processor (12th Gen),8.0,Windows 11 Operating System,512.0,39.62,4.3
